{"$defs":{"humanAuthority":{"additionalProperties":false,"properties":{"actor":{"anyOf":[{"minLength":1,"type":"string"},{"type":"null"}]},"comment_id":{"anyOf":[{"minimum":1,"type":"integer"},{"type":"null"}]},"commit_sha":{"anyOf":[{"pattern":"^[0-9a-f]{40}$","type":"string"},{"type":"null"}]},"disposition":{"anyOf":[{"minLength":1,"type":"string"},{"type":"null"}]},"required":{"type":"boolean"},"state":{"enum":["NOT_REQUIRED","PENDING","AUTHORIZED","DECLINED","UNKNOWN"],"type":"string"}},"required":["required","state","comment_id","actor","commit_sha","disposition"],"type":"object"},"reviewAuthority":{"additionalProperties":false,"properties":{"actor":{"anyOf":[{"minLength":1,"type":"string"},{"type":"null"}]},"commit_sha":{"anyOf":[{"pattern":"^[0-9a-f]{40}$","type":"string"},{"type":"null"}]},"required":{"type":"boolean"},"review_id":{"anyOf":[{"minimum":1,"type":"integer"},{"type":"null"}]},"state":{"enum":["NOT_REQUIRED","PENDING","APPROVED","CHANGES_REQUESTED","UNKNOWN"],"type":"string"}},"required":["required","state","review_id","actor","commit_sha"],"type":"object"}},"$id":"https://grandchallenge.ai/schemas/pr_visual_status_report.schema.json","$schema":"https://json-schema.org/draft/2020-12/schema","additionalProperties":false,"properties":{"authority":{"additionalProperties":false,"properties":{"human_steward":{"$ref":"#/$defs/humanAuthority"},"independent_review":{"$ref":"#/$defs/reviewAuthority"}},"required":["independent_review","human_steward"],"type":"object"},"blockers":{"items":{"additionalProperties":false,"properties":{"id":{"minLength":1,"type":"string"},"status":{"enum":["OPEN","CLOSED"],"type":"string"},"summary":{"minLength":1,"type":"string"}},"required":["id","status","summary"],"type":"object"},"type":"array"},"checks":{"items":{"additionalProperties":false,"properties":{"conclusion":{"anyOf":[{"enum":["success","failure","cancelled","skipped","neutral","action_required","timed_out","stale","unknown"],"type":"string"},{"type":"null"}]},"head_sha":{"anyOf":[{"pattern":"^[0-9a-f]{40}$","type":"string"},{"type":"null"}]},"name":{"minLength":1,"type":"string"},"required":{"type":"boolean"},"run_id":{"anyOf":[{"minimum":1,"type":"integer"},{"type":"null"}]},"status":{"enum":["queued","in_progress","completed","unknown"],"type":"string"}},"required":["name","required","status","conclusion","run_id","head_sha"],"type":"object"},"type":"array"},"derived":{"additionalProperties":false,"properties":{"freshness":{"enum":["CURRENT","STALE","UNKNOWN"],"type":"string"},"operative_state":{"enum":["STALE","UNKNOWN","BLOCKED","CHANGES_REQUESTED","CHECKS_PENDING","REVIEW_PENDING","AUTHORIZATION_PENDING","READY_FOR_MERGE","AUTHORIZED_FOR_PROTECTED_MERGE","MERGED_READBACK_PENDING","PROTECTED_COMPLETE","MERGED","CLOSED_UNMERGED"],"type":"string"},"reasons":{"items":{"minLength":1,"type":"string"},"type":"array"}},"required":["freshness","operative_state","reasons"],"type":"object"},"history":{"items":{"additionalProperties":false,"properties":{"at":{"format":"date-time","type":"string"},"event":{"minLength":1,"type":"string"},"outcome":{"minLength":1,"type":"string"}},"required":["at","event","outcome"],"type":"object"},"type":"array"},"identity":{"additionalProperties":false,"properties":{"current_head_sha":{"anyOf":[{"pattern":"^[0-9a-f]{40}$","type":"string"},{"type":"null"}]},"exact_head_sha":{"pattern":"^[0-9a-f]{40}$","type":"string"},"pr_number":{"minimum":1,"type":"integer"},"repository":{"pattern":"^[^/\\s]+/[^/\\s]+$","type":"string"},"title":{"minLength":1,"type":"string"}},"required":["repository","pr_number","title","exact_head_sha","current_head_sha"],"type":"object"},"integration":{"additionalProperties":false,"properties":{"merge_commit_sha":{"anyOf":[{"pattern":"^[0-9a-f]{40}$","type":"string"},{"type":"null"}]},"merge_state":{"enum":["OPEN","MERGED","CLOSED_UNMERGED","UNKNOWN"],"type":"string"},"protected_readback":{"additionalProperties":false,"properties":{"main_sha":{"anyOf":[{"pattern":"^[0-9a-f]{40}$","type":"string"},{"type":"null"}]},"required":{"type":"boolean"},"state":{"enum":["NOT_APPLICABLE","PENDING","COMPLETE","BLOCKED","UNKNOWN"],"type":"string"}},"required":["required","state","main_sha"],"type":"object"}},"required":["merge_state","merge_commit_sha","protected_readback"],"type":"object"},"modules":{"additionalProperties":true,"type":"object"},"nonclaims":{"items":{"minLength":1,"type":"string"},"type":"array","uniqueItems":true},"provenance":{"additionalProperties":false,"properties":{"generator_version":{"minLength":1,"type":"string"},"observed_at":{"format":"date-time","type":"string"},"schema_version":{"const":"1.0.0","type":"string"},"source_snapshot_sha256":{"pattern":"^[0-9a-f]{64}$","type":"string"}},"required":["observed_at","schema_version","generator_version","source_snapshot_sha256"],"type":"object"},"report_id":{"minLength":1,"type":"string"},"significance":{"additionalProperties":false,"properties":{"manual_override":{"additionalProperties":false,"properties":{"authority":{"anyOf":[{"enum":["Human Steward","Referee","Council"],"type":"string"},{"type":"null"}]},"enabled":{"type":"boolean"},"reason":{"anyOf":[{"minLength":1,"type":"string"},{"type":"null"}]}},"required":["enabled","authority","reason"],"type":"object"},"profile_version":{"const":"1.0.0","type":"string"},"significant":{"type":"boolean"},"triggers":{"items":{"minLength":1,"type":"string"},"type":"array","uniqueItems":true}},"required":["profile_version","significant","triggers","manual_override"],"type":"object"}},"required":["report_id","identity","significance","authority","checks","integration","blockers","nonclaims","history","modules","provenance","derived"],"title":"PR Visual Status Report","type":"object"}
