{
  "authority": {
    "human_steward": {
      "actor": null,
      "comment_id": null,
      "commit_sha": null,
      "disposition": null,
      "required": false,
      "state": "UNKNOWN"
    },
    "independent_review": {
      "actor": null,
      "commit_sha": null,
      "required": false,
      "review_id": null,
      "state": "NOT_REQUIRED"
    }
  },
  "blockers": [],
  "checks": [
    {
      "conclusion": null,
      "head_sha": "c529c4a1e9da6535a4552fbc10fb54992494a7dd",
      "name": "formal-validation / formal-validation",
      "required": true,
      "run_id": null,
      "status": "queued"
    },
    {
      "conclusion": "success",
      "head_sha": "c529c4a1e9da6535a4552fbc10fb54992494a7dd",
      "name": "policy / policy",
      "required": true,
      "run_id": 111036116096,
      "status": "completed"
    },
    {
      "conclusion": null,
      "head_sha": "c529c4a1e9da6535a4552fbc10fb54992494a7dd",
      "name": "routing-enforcement",
      "required": true,
      "run_id": null,
      "status": "queued"
    },
    {
      "conclusion": "success",
      "head_sha": "c529c4a1e9da6535a4552fbc10fb54992494a7dd",
      "name": "security / action-policy",
      "required": true,
      "run_id": 111036115967,
      "status": "completed"
    },
    {
      "conclusion": null,
      "head_sha": "c529c4a1e9da6535a4552fbc10fb54992494a7dd",
      "name": "validate-json",
      "required": true,
      "run_id": null,
      "status": "queued"
    }
  ],
  "derived": {
    "freshness": "CURRENT",
    "operative_state": "CHECKS_PENDING",
    "reasons": [
      "3 required check(s) are not complete"
    ]
  },
  "history": [
    {
      "at": "2026-10-02T21:24:36Z",
      "event": "PR_CREATED",
      "outcome": "RETAINED"
    },
    {
      "at": "2026-10-02T21:24:37Z",
      "event": "PR_UPDATED",
      "outcome": "RETAINED"
    }
  ],
  "identity": {
    "current_head_sha": "c529c4a1e9da6535a4552fbc10fb54992494a7dd",
    "exact_head_sha": "c529c4a1e9da6535a4552fbc10fb54992494a7dd",
    "pr_number": 1143,
    "repository": "grandchallenge/MATH-PROGRAMME",
    "title": "Rebind VGSE M0 continuity to rebased exact candidate"
  },
  "integration": {
    "merge_commit_sha": "cb657a4e12d2d1cd57990c579b6a99fbacbe5aad",
    "merge_state": "OPEN",
    "protected_readback": {
      "main_sha": null,
      "required": true,
      "state": "PENDING"
    }
  },
  "modules": {
    "phase1": {
      "changed_file_count": 1,
      "collector_limitations": [],
      "config_version": "1.0.0",
      "issue": 462,
      "observed_check_runs": [
        {
          "check_run_id": 111036104374,
          "conclusion": null,
          "head_sha": "c529c4a1e9da6535a4552fbc10fb54992494a7dd",
          "name": "Analyze (actions)",
          "status": "in_progress"
        },
        {
          "check_run_id": 111036104680,
          "conclusion": null,
          "head_sha": "c529c4a1e9da6535a4552fbc10fb54992494a7dd",
          "name": "Analyze (c-cpp)",
          "status": "in_progress"
        },
        {
          "check_run_id": 111036104546,
          "conclusion": null,
          "head_sha": "c529c4a1e9da6535a4552fbc10fb54992494a7dd",
          "name": "Analyze (python)",
          "status": "in_progress"
        },
        {
          "check_run_id": 111036112189,
          "conclusion": "success",
          "head_sha": "c529c4a1e9da6535a4552fbc10fb54992494a7dd",
          "name": "Classify material formal closure",
          "status": "completed"
        },
        {
          "check_run_id": 111036111638,
          "conclusion": "success",
          "head_sha": "c529c4a1e9da6535a4552fbc10fb54992494a7dd",
          "name": "Classify policy impact",
          "status": "completed"
        },
        {
          "check_run_id": 111036111124,
          "conclusion": "success",
          "head_sha": "c529c4a1e9da6535a4552fbc10fb54992494a7dd",
          "name": "Evaluate protected maintenance triggers",
          "status": "completed"
        },
        {
          "check_run_id": 111036115847,
          "conclusion": "success",
          "head_sha": "c529c4a1e9da6535a4552fbc10fb54992494a7dd",
          "name": "GCL ASSURE PR synthetic dossier",
          "status": "completed"
        },
        {
          "check_run_id": 111036115615,
          "conclusion": "success",
          "head_sha": "c529c4a1e9da6535a4552fbc10fb54992494a7dd",
          "name": "GCL DISCLOSE PR synthetic release gate",
          "status": "completed"
        },
        {
          "check_run_id": 111036116040,
          "conclusion": "skipped",
          "head_sha": "c529c4a1e9da6535a4552fbc10fb54992494a7dd",
          "name": "GH-OS merge-group admission controller",
          "status": "completed"
        },
        {
          "check_run_id": 111036114054,
          "conclusion": null,
          "head_sha": "c529c4a1e9da6535a4552fbc10fb54992494a7dd",
          "name": "GH-OS pre-queue effective candidate controller",
          "status": "in_progress"
        },
        {
          "check_run_id": 111036116184,
          "conclusion": "skipped",
          "head_sha": "c529c4a1e9da6535a4552fbc10fb54992494a7dd",
          "name": "GH-OS protected-base revalidation dispatcher",
          "status": "completed"
        },
        {
          "check_run_id": 111036200373,
          "conclusion": null,
          "head_sha": "c529c4a1e9da6535a4552fbc10fb54992494a7dd",
          "name": "Policy shard / contracts",
          "status": "queued"
        },
        {
          "check_run_id": 111036200180,
          "conclusion": null,
          "head_sha": "c529c4a1e9da6535a4552fbc10fb54992494a7dd",
          "name": "Policy shard / core",
          "status": "queued"
        },
        {
          "check_run_id": 111036114003,
          "conclusion": "success",
          "head_sha": "c529c4a1e9da6535a4552fbc10fb54992494a7dd",
          "name": "admit",
          "status": "completed"
        },
        {
          "check_run_id": 111036114527,
          "conclusion": null,
          "head_sha": "c529c4a1e9da6535a4552fbc10fb54992494a7dd",
          "name": "advisory-report",
          "status": "in_progress"
        },
        {
          "check_run_id": 111036193708,
          "conclusion": null,
          "head_sha": "c529c4a1e9da6535a4552fbc10fb54992494a7dd",
          "name": "formal-validation",
          "status": "queued"
        },
        {
          "check_run_id": 111036194787,
          "conclusion": "skipped",
          "head_sha": "c529c4a1e9da6535a4552fbc10fb54992494a7dd",
          "name": "matrix.lane",
          "status": "completed"
        },
        {
          "check_run_id": 111036116096,
          "conclusion": "success",
          "head_sha": "c529c4a1e9da6535a4552fbc10fb54992494a7dd",
          "name": "policy / policy",
          "status": "completed"
        },
        {
          "check_run_id": 111036116161,
          "conclusion": "skipped",
          "head_sha": "c529c4a1e9da6535a4552fbc10fb54992494a7dd",
          "name": "qualify",
          "status": "completed"
        },
        {
          "check_run_id": 111036115967,
          "conclusion": "success",
          "head_sha": "c529c4a1e9da6535a4552fbc10fb54992494a7dd",
          "name": "security / action-policy",
          "status": "completed"
        }
      ],
      "observed_human_steward_markers": [],
      "observed_non_author_reviews": [],
      "operation": "PRVSR-PHASE1-IMPLEMENTATION-001",
      "required_status_contexts": [
        "formal-validation / formal-validation",
        "policy / policy",
        "routing-enforcement",
        "security / action-policy",
        "validate-json"
      ],
      "ruleset_source_available": true
    }
  },
  "nonclaims": [
    "PRVSR is advisory and derived; authoritative GitHub/governance records remain controlling.",
    "Report absence, staleness, generation failure, render failure, or archive failure is not a merge blocker.",
    "No cross-repository propagation authority is created.",
    "No claim is made that reviewer speed or factual accuracy improves.",
    "Machine collection does not infer missing human, mathematical, source-admission, or certification authority."
  ],
  "provenance": {
    "generator_version": "0.1.0-pilot",
    "observed_at": "2026-10-02T21:24:54Z",
    "schema_version": "1.0.0",
    "source_snapshot_sha256": "4fd6f1583f9e7dc9d9da24b4a9f68b19617851c23c1da5553408713f08845263"
  },
  "report_id": "PRVSR-LIVE-PR1143-c529c4a1e9da-20261002212454",
  "significance": {
    "manual_override": {
      "authority": null,
      "enabled": false,
      "reason": null
    },
    "profile_version": "1.0.0",
    "significant": true,
    "triggers": [
      "governance_or_control_plane"
    ]
  }
}
