{
  "authority": {
    "human_steward": {
      "actor": null,
      "comment_id": null,
      "commit_sha": null,
      "disposition": null,
      "required": false,
      "state": "UNKNOWN"
    },
    "independent_review": {
      "actor": null,
      "commit_sha": null,
      "required": false,
      "review_id": null,
      "state": "NOT_REQUIRED"
    }
  },
  "blockers": [],
  "checks": [
    {
      "conclusion": null,
      "head_sha": "46a9ba3c8d1fd6b49f83659cedc8c50cb140c193",
      "name": "formal-validation / formal-validation",
      "required": true,
      "run_id": null,
      "status": "queued"
    },
    {
      "conclusion": "success",
      "head_sha": "46a9ba3c8d1fd6b49f83659cedc8c50cb140c193",
      "name": "policy / policy",
      "required": true,
      "run_id": 114712096477,
      "status": "completed"
    },
    {
      "conclusion": null,
      "head_sha": "46a9ba3c8d1fd6b49f83659cedc8c50cb140c193",
      "name": "routing-enforcement",
      "required": true,
      "run_id": null,
      "status": "queued"
    },
    {
      "conclusion": null,
      "head_sha": "46a9ba3c8d1fd6b49f83659cedc8c50cb140c193",
      "name": "security / action-policy",
      "required": true,
      "run_id": 114712096517,
      "status": "in_progress"
    },
    {
      "conclusion": null,
      "head_sha": "46a9ba3c8d1fd6b49f83659cedc8c50cb140c193",
      "name": "validate-json",
      "required": true,
      "run_id": null,
      "status": "queued"
    }
  ],
  "derived": {
    "freshness": "CURRENT",
    "operative_state": "CHECKS_PENDING",
    "reasons": [
      "4 required check(s) are not complete"
    ]
  },
  "history": [
    {
      "at": "2026-10-12T05:51:11Z",
      "event": "PR_CREATED",
      "outcome": "RETAINED"
    },
    {
      "at": "2026-10-12T07:45:10Z",
      "event": "PR_UPDATED",
      "outcome": "RETAINED"
    }
  ],
  "identity": {
    "current_head_sha": "46a9ba3c8d1fd6b49f83659cedc8c50cb140c193",
    "exact_head_sha": "46a9ba3c8d1fd6b49f83659cedc8c50cb140c193",
    "pr_number": 2590,
    "repository": "grandchallenge/MATH-PROGRAMME",
    "title": "Compendium wave A: four sourced geometric and combinatorial Erd\u0151s explanations"
  },
  "integration": {
    "merge_commit_sha": "afda02a170bf9baf74b26e468db727db08f4eaa0",
    "merge_state": "OPEN",
    "protected_readback": {
      "main_sha": null,
      "required": true,
      "state": "PENDING"
    }
  },
  "modules": {
    "phase1": {
      "changed_file_count": 5,
      "collector_limitations": [],
      "config_version": "1.0.0",
      "issue": 462,
      "observed_check_runs": [
        {
          "check_run_id": 114712082406,
          "conclusion": null,
          "head_sha": "46a9ba3c8d1fd6b49f83659cedc8c50cb140c193",
          "name": "Analyze (actions)",
          "status": "in_progress"
        },
        {
          "check_run_id": 114712082469,
          "conclusion": null,
          "head_sha": "46a9ba3c8d1fd6b49f83659cedc8c50cb140c193",
          "name": "Analyze (c-cpp)",
          "status": "in_progress"
        },
        {
          "check_run_id": 114712082498,
          "conclusion": null,
          "head_sha": "46a9ba3c8d1fd6b49f83659cedc8c50cb140c193",
          "name": "Analyze (python)",
          "status": "in_progress"
        },
        {
          "check_run_id": 114712093367,
          "conclusion": null,
          "head_sha": "46a9ba3c8d1fd6b49f83659cedc8c50cb140c193",
          "name": "Classify material formal closure",
          "status": "in_progress"
        },
        {
          "check_run_id": 114712093246,
          "conclusion": null,
          "head_sha": "46a9ba3c8d1fd6b49f83659cedc8c50cb140c193",
          "name": "Classify policy impact",
          "status": "in_progress"
        },
        {
          "check_run_id": 114712092516,
          "conclusion": null,
          "head_sha": "46a9ba3c8d1fd6b49f83659cedc8c50cb140c193",
          "name": "Evaluate protected maintenance triggers",
          "status": "in_progress"
        },
        {
          "check_run_id": 114712096347,
          "conclusion": null,
          "head_sha": "46a9ba3c8d1fd6b49f83659cedc8c50cb140c193",
          "name": "GCL ASSURE PR synthetic dossier",
          "status": "in_progress"
        },
        {
          "check_run_id": 114712096095,
          "conclusion": null,
          "head_sha": "46a9ba3c8d1fd6b49f83659cedc8c50cb140c193",
          "name": "GCL DISCLOSE PR synthetic release gate",
          "status": "in_progress"
        },
        {
          "check_run_id": 114712085113,
          "conclusion": "skipped",
          "head_sha": "46a9ba3c8d1fd6b49f83659cedc8c50cb140c193",
          "name": "GH-OS merge-group admission controller",
          "status": "completed"
        },
        {
          "check_run_id": 114712083708,
          "conclusion": null,
          "head_sha": "46a9ba3c8d1fd6b49f83659cedc8c50cb140c193",
          "name": "GH-OS pre-queue effective candidate controller",
          "status": "in_progress"
        },
        {
          "check_run_id": 114712085259,
          "conclusion": "skipped",
          "head_sha": "46a9ba3c8d1fd6b49f83659cedc8c50cb140c193",
          "name": "GH-OS protected-base revalidation dispatcher",
          "status": "completed"
        },
        {
          "check_run_id": 114712083609,
          "conclusion": null,
          "head_sha": "46a9ba3c8d1fd6b49f83659cedc8c50cb140c193",
          "name": "Observe material closure (no admission authority)",
          "status": "in_progress"
        },
        {
          "check_run_id": 114712084201,
          "conclusion": null,
          "head_sha": "46a9ba3c8d1fd6b49f83659cedc8c50cb140c193",
          "name": "Protected material-profile delegated review",
          "status": "in_progress"
        },
        {
          "check_run_id": 114712092850,
          "conclusion": "success",
          "head_sha": "46a9ba3c8d1fd6b49f83659cedc8c50cb140c193",
          "name": "Queue class cutover positive and hostile tests",
          "status": "completed"
        },
        {
          "check_run_id": 114712083908,
          "conclusion": "success",
          "head_sha": "46a9ba3c8d1fd6b49f83659cedc8c50cb140c193",
          "name": "admit",
          "status": "completed"
        },
        {
          "check_run_id": 114712083880,
          "conclusion": null,
          "head_sha": "46a9ba3c8d1fd6b49f83659cedc8c50cb140c193",
          "name": "advisory-report",
          "status": "in_progress"
        },
        {
          "check_run_id": 114712096477,
          "conclusion": "success",
          "head_sha": "46a9ba3c8d1fd6b49f83659cedc8c50cb140c193",
          "name": "policy / policy",
          "status": "completed"
        },
        {
          "check_run_id": 114712085303,
          "conclusion": "skipped",
          "head_sha": "46a9ba3c8d1fd6b49f83659cedc8c50cb140c193",
          "name": "qualify",
          "status": "completed"
        },
        {
          "check_run_id": 114712096517,
          "conclusion": null,
          "head_sha": "46a9ba3c8d1fd6b49f83659cedc8c50cb140c193",
          "name": "security / action-policy",
          "status": "in_progress"
        }
      ],
      "observed_human_steward_markers": [],
      "observed_non_author_reviews": [
        {
          "actor": "jimsteeg",
          "commit_sha": "95d79b0ce6e985a63b0efb61e31bc96074c2c098",
          "review_id": 5487045352,
          "state": "DISMISSED",
          "submitted_at": "2026-10-12T06:09:44Z"
        }
      ],
      "operation": "PRVSR-PHASE1-IMPLEMENTATION-001",
      "required_status_contexts": [
        "formal-validation / formal-validation",
        "policy / policy",
        "routing-enforcement",
        "security / action-policy",
        "validate-json"
      ],
      "ruleset_source_available": true
    }
  },
  "nonclaims": [
    "PRVSR is advisory and derived; authoritative GitHub/governance records remain controlling.",
    "Report absence, staleness, generation failure, render failure, or archive failure is not a merge blocker.",
    "No cross-repository propagation authority is created.",
    "No claim is made that reviewer speed or factual accuracy improves.",
    "Machine collection does not infer missing human, mathematical, source-admission, or certification authority."
  ],
  "provenance": {
    "generator_version": "0.1.0-pilot",
    "observed_at": "2026-10-12T07:45:23Z",
    "schema_version": "1.0.0",
    "source_snapshot_sha256": "7850db7a8eea4f48b0cba54c5f37b87f24b5cb308491bc903af2371b10253e1a"
  },
  "report_id": "PRVSR-LIVE-PR2590-46a9ba3c8d1f-20261012074523",
  "significance": {
    "manual_override": {
      "authority": null,
      "enabled": false,
      "reason": null
    },
    "profile_version": "1.0.0",
    "significant": true,
    "triggers": [
      "governance_or_control_plane",
      "repository_policy_or_workflow"
    ]
  }
}
