{
  "authority": {
    "human_steward": {
      "actor": null,
      "comment_id": null,
      "commit_sha": null,
      "disposition": null,
      "required": false,
      "state": "UNKNOWN"
    },
    "independent_review": {
      "actor": null,
      "commit_sha": null,
      "required": false,
      "review_id": null,
      "state": "NOT_REQUIRED"
    }
  },
  "blockers": [],
  "checks": [
    {
      "conclusion": null,
      "head_sha": "51110c1acf6060114b5c6874d57e975360ec1477",
      "name": "Replay LOG-GCD-001 in Lean",
      "required": true,
      "run_id": null,
      "status": "queued"
    },
    {
      "conclusion": null,
      "head_sha": "51110c1acf6060114b5c6874d57e975360ec1477",
      "name": "Replay PC-WP04 bounded certificate",
      "required": true,
      "run_id": null,
      "status": "queued"
    },
    {
      "conclusion": null,
      "head_sha": "51110c1acf6060114b5c6874d57e975360ec1477",
      "name": "Replay pinned Union-Closed MATHCERT evidence",
      "required": true,
      "run_id": null,
      "status": "queued"
    },
    {
      "conclusion": "success",
      "head_sha": "51110c1acf6060114b5c6874d57e975360ec1477",
      "name": "policy / policy",
      "required": true,
      "run_id": 96609138119,
      "status": "completed"
    },
    {
      "conclusion": "success",
      "head_sha": "51110c1acf6060114b5c6874d57e975360ec1477",
      "name": "security / action-policy",
      "required": true,
      "run_id": 96609138041,
      "status": "completed"
    },
    {
      "conclusion": null,
      "head_sha": "51110c1acf6060114b5c6874d57e975360ec1477",
      "name": "validate-json",
      "required": true,
      "run_id": null,
      "status": "queued"
    }
  ],
  "derived": {
    "freshness": "CURRENT",
    "operative_state": "CHECKS_PENDING",
    "reasons": [
      "4 required check(s) are not complete"
    ]
  },
  "history": [
    {
      "at": "2026-08-20T22:50:21Z",
      "event": "PR_CREATED",
      "outcome": "RETAINED"
    },
    {
      "at": "2026-08-20T22:55:18Z",
      "event": "PR_UPDATED",
      "outcome": "RETAINED"
    }
  ],
  "identity": {
    "current_head_sha": "51110c1acf6060114b5c6874d57e975360ec1477",
    "exact_head_sha": "51110c1acf6060114b5c6874d57e975360ec1477",
    "pr_number": 636,
    "repository": "grandchallenge/MATH-PROGRAMME",
    "title": "MP-ADMIN-LOW-FRICTION-001: close routine PR lifecycle without repeated Steward checkpoints"
  },
  "integration": {
    "merge_commit_sha": "c14b1e3145a102eba4ff8b984d4cc4da7579d49c",
    "merge_state": "OPEN",
    "protected_readback": {
      "main_sha": null,
      "required": true,
      "state": "PENDING"
    }
  },
  "modules": {
    "phase1": {
      "changed_file_count": 5,
      "collector_limitations": [],
      "config_version": "1.0.0",
      "issue": 462,
      "observed_check_runs": [
        {
          "check_run_id": 96609131857,
          "conclusion": null,
          "head_sha": "51110c1acf6060114b5c6874d57e975360ec1477",
          "name": "Analyze (actions)",
          "status": "in_progress"
        },
        {
          "check_run_id": 96609132085,
          "conclusion": null,
          "head_sha": "51110c1acf6060114b5c6874d57e975360ec1477",
          "name": "Analyze (c-cpp)",
          "status": "in_progress"
        },
        {
          "check_run_id": 96609132035,
          "conclusion": null,
          "head_sha": "51110c1acf6060114b5c6874d57e975360ec1477",
          "name": "Analyze (python)",
          "status": "in_progress"
        },
        {
          "check_run_id": 96609240513,
          "conclusion": null,
          "head_sha": "51110c1acf6060114b5c6874d57e975360ec1477",
          "name": "Classify policy impact",
          "status": "queued"
        },
        {
          "check_run_id": 96609227562,
          "conclusion": "neutral",
          "head_sha": "51110c1acf6060114b5c6874d57e975360ec1477",
          "name": "CodeQL",
          "status": "completed"
        },
        {
          "check_run_id": 96609143626,
          "conclusion": "success",
          "head_sha": "51110c1acf6060114b5c6874d57e975360ec1477",
          "name": "Evaluate protected maintenance triggers",
          "status": "completed"
        },
        {
          "check_run_id": 96609137782,
          "conclusion": "success",
          "head_sha": "51110c1acf6060114b5c6874d57e975360ec1477",
          "name": "GCL ASSURE PR synthetic dossier",
          "status": "completed"
        },
        {
          "check_run_id": 96609138010,
          "conclusion": "success",
          "head_sha": "51110c1acf6060114b5c6874d57e975360ec1477",
          "name": "GCL DISCLOSE PR synthetic release gate",
          "status": "completed"
        },
        {
          "check_run_id": 96609130374,
          "conclusion": "success",
          "head_sha": "51110c1acf6060114b5c6874d57e975360ec1477",
          "name": "admit",
          "status": "completed"
        },
        {
          "check_run_id": 96609138119,
          "conclusion": "success",
          "head_sha": "51110c1acf6060114b5c6874d57e975360ec1477",
          "name": "policy / policy",
          "status": "completed"
        },
        {
          "check_run_id": 96609131604,
          "conclusion": "skipped",
          "head_sha": "51110c1acf6060114b5c6874d57e975360ec1477",
          "name": "qualify",
          "status": "completed"
        },
        {
          "check_run_id": 96609138041,
          "conclusion": "success",
          "head_sha": "51110c1acf6060114b5c6874d57e975360ec1477",
          "name": "security / action-policy",
          "status": "completed"
        },
        {
          "check_run_id": 96609136101,
          "conclusion": "failure",
          "head_sha": "51110c1acf6060114b5c6874d57e975360ec1477",
          "name": "validate",
          "status": "completed"
        }
      ],
      "observed_human_steward_markers": [],
      "observed_non_author_reviews": [],
      "operation": "PRVSR-PHASE1-IMPLEMENTATION-001",
      "required_status_contexts": [
        "Replay LOG-GCD-001 in Lean",
        "Replay PC-WP04 bounded certificate",
        "Replay pinned Union-Closed MATHCERT evidence",
        "policy / policy",
        "security / action-policy",
        "validate-json"
      ],
      "ruleset_source_available": true
    }
  },
  "nonclaims": [
    "PRVSR is advisory and derived; authoritative GitHub/governance records remain controlling.",
    "Report absence, staleness, generation failure, render failure, or archive failure is not a merge blocker.",
    "No cross-repository propagation authority is created.",
    "No claim is made that reviewer speed or factual accuracy improves.",
    "Machine collection does not infer missing human, mathematical, source-admission, or certification authority."
  ],
  "provenance": {
    "generator_version": "0.1.0-pilot",
    "observed_at": "2026-08-20T22:55:38Z",
    "schema_version": "1.0.0",
    "source_snapshot_sha256": "819449d3f598c0146acf347f633386e1aa4b0aed293d3f9c896588c0fd478573"
  },
  "report_id": "PRVSR-LIVE-PR636-51110c1acf60-20260820225538",
  "significance": {
    "manual_override": {
      "authority": null,
      "enabled": false,
      "reason": null
    },
    "profile_version": "1.0.0",
    "significant": true,
    "triggers": [
      "formal_disposition",
      "governance_or_control_plane",
      "administrative_automation"
    ]
  }
}
