{
  "authority": {
    "human_steward": {
      "actor": null,
      "comment_id": null,
      "commit_sha": null,
      "disposition": null,
      "required": false,
      "state": "UNKNOWN"
    },
    "independent_review": {
      "actor": null,
      "commit_sha": null,
      "required": false,
      "review_id": null,
      "state": "NOT_REQUIRED"
    }
  },
  "blockers": [],
  "checks": [
    {
      "conclusion": null,
      "head_sha": "62efafa9ce7c90278ae5c75b1d6bf28fc4e2e7be",
      "name": "Replay LOG-GCD-001 in Lean",
      "required": true,
      "run_id": 94426507239,
      "status": "queued"
    },
    {
      "conclusion": null,
      "head_sha": "62efafa9ce7c90278ae5c75b1d6bf28fc4e2e7be",
      "name": "Replay PC-WP04 bounded certificate",
      "required": true,
      "run_id": 94426507149,
      "status": "queued"
    },
    {
      "conclusion": null,
      "head_sha": "62efafa9ce7c90278ae5c75b1d6bf28fc4e2e7be",
      "name": "Replay pinned Union-Closed MATHCERT evidence",
      "required": true,
      "run_id": 94426507235,
      "status": "in_progress"
    },
    {
      "conclusion": null,
      "head_sha": "62efafa9ce7c90278ae5c75b1d6bf28fc4e2e7be",
      "name": "policy / policy",
      "required": true,
      "run_id": 94426477382,
      "status": "in_progress"
    },
    {
      "conclusion": null,
      "head_sha": "62efafa9ce7c90278ae5c75b1d6bf28fc4e2e7be",
      "name": "security / action-policy",
      "required": true,
      "run_id": 94426477457,
      "status": "in_progress"
    },
    {
      "conclusion": null,
      "head_sha": "62efafa9ce7c90278ae5c75b1d6bf28fc4e2e7be",
      "name": "validate-json",
      "required": true,
      "run_id": null,
      "status": "queued"
    }
  ],
  "derived": {
    "freshness": "CURRENT",
    "operative_state": "CHECKS_PENDING",
    "reasons": [
      "6 required check(s) are not complete"
    ]
  },
  "history": [
    {
      "at": "2026-08-13T08:33:00Z",
      "event": "PR_CREATED",
      "outcome": "RETAINED"
    },
    {
      "at": "2026-08-13T11:01:28Z",
      "event": "PR_UPDATED",
      "outcome": "RETAINED"
    }
  ],
  "identity": {
    "current_head_sha": "62efafa9ce7c90278ae5c75b1d6bf28fc4e2e7be",
    "exact_head_sha": "62efafa9ce7c90278ae5c75b1d6bf28fc4e2e7be",
    "pr_number": 503,
    "repository": "grandchallenge/MATH-PROGRAMME",
    "title": "MP-ADMIN-RECEIPT-REPAIR-476-001: normalize malformed protected review receipt"
  },
  "integration": {
    "merge_commit_sha": "892478c3ea2f72dc16db8ddd33936e10423008f2",
    "merge_state": "OPEN",
    "protected_readback": {
      "main_sha": null,
      "required": true,
      "state": "PENDING"
    }
  },
  "modules": {
    "phase1": {
      "changed_file_count": 5,
      "collector_limitations": [],
      "config_version": "1.0.0",
      "issue": 462,
      "observed_check_runs": [
        {
          "check_run_id": 94426471934,
          "conclusion": null,
          "head_sha": "62efafa9ce7c90278ae5c75b1d6bf28fc4e2e7be",
          "name": "Analyze (actions)",
          "status": "in_progress"
        },
        {
          "check_run_id": 94426471890,
          "conclusion": null,
          "head_sha": "62efafa9ce7c90278ae5c75b1d6bf28fc4e2e7be",
          "name": "Analyze (c-cpp)",
          "status": "in_progress"
        },
        {
          "check_run_id": 94426471939,
          "conclusion": null,
          "head_sha": "62efafa9ce7c90278ae5c75b1d6bf28fc4e2e7be",
          "name": "Analyze (python)",
          "status": "in_progress"
        },
        {
          "check_run_id": 94426476000,
          "conclusion": "success",
          "head_sha": "62efafa9ce7c90278ae5c75b1d6bf28fc4e2e7be",
          "name": "Classify policy impact",
          "status": "completed"
        },
        {
          "check_run_id": 94426475568,
          "conclusion": "success",
          "head_sha": "62efafa9ce7c90278ae5c75b1d6bf28fc4e2e7be",
          "name": "Evaluate protected maintenance triggers",
          "status": "completed"
        },
        {
          "check_run_id": 94426477347,
          "conclusion": null,
          "head_sha": "62efafa9ce7c90278ae5c75b1d6bf28fc4e2e7be",
          "name": "GCL ASSURE PR synthetic dossier",
          "status": "in_progress"
        },
        {
          "check_run_id": 94426477263,
          "conclusion": null,
          "head_sha": "62efafa9ce7c90278ae5c75b1d6bf28fc4e2e7be",
          "name": "GCL DISCLOSE PR synthetic release gate",
          "status": "in_progress"
        },
        {
          "check_run_id": 94426507301,
          "conclusion": null,
          "head_sha": "62efafa9ce7c90278ae5c75b1d6bf28fc4e2e7be",
          "name": "Policy shard / administrative",
          "status": "in_progress"
        },
        {
          "check_run_id": 94426507309,
          "conclusion": null,
          "head_sha": "62efafa9ce7c90278ae5c75b1d6bf28fc4e2e7be",
          "name": "Policy shard / campaigns",
          "status": "in_progress"
        },
        {
          "check_run_id": 94426507294,
          "conclusion": null,
          "head_sha": "62efafa9ce7c90278ae5c75b1d6bf28fc4e2e7be",
          "name": "Policy shard / cmdg",
          "status": "in_progress"
        },
        {
          "check_run_id": 94426507377,
          "conclusion": null,
          "head_sha": "62efafa9ce7c90278ae5c75b1d6bf28fc4e2e7be",
          "name": "Policy shard / contracts",
          "status": "queued"
        },
        {
          "check_run_id": 94426507296,
          "conclusion": null,
          "head_sha": "62efafa9ce7c90278ae5c75b1d6bf28fc4e2e7be",
          "name": "Policy shard / core",
          "status": "in_progress"
        },
        {
          "check_run_id": 94426507310,
          "conclusion": null,
          "head_sha": "62efafa9ce7c90278ae5c75b1d6bf28fc4e2e7be",
          "name": "Policy shard / docs",
          "status": "in_progress"
        },
        {
          "check_run_id": 94426507270,
          "conclusion": null,
          "head_sha": "62efafa9ce7c90278ae5c75b1d6bf28fc4e2e7be",
          "name": "Policy shard / fixtures",
          "status": "queued"
        },
        {
          "check_run_id": 94426507239,
          "conclusion": null,
          "head_sha": "62efafa9ce7c90278ae5c75b1d6bf28fc4e2e7be",
          "name": "Replay LOG-GCD-001 in Lean",
          "status": "queued"
        },
        {
          "check_run_id": 94426507149,
          "conclusion": null,
          "head_sha": "62efafa9ce7c90278ae5c75b1d6bf28fc4e2e7be",
          "name": "Replay PC-WP04 bounded certificate",
          "status": "queued"
        },
        {
          "check_run_id": 94426507235,
          "conclusion": null,
          "head_sha": "62efafa9ce7c90278ae5c75b1d6bf28fc4e2e7be",
          "name": "Replay pinned Union-Closed MATHCERT evidence",
          "status": "in_progress"
        },
        {
          "check_run_id": 94426478672,
          "conclusion": null,
          "head_sha": "62efafa9ce7c90278ae5c75b1d6bf28fc4e2e7be",
          "name": "advisory-report",
          "status": "in_progress"
        },
        {
          "check_run_id": 94426477382,
          "conclusion": null,
          "head_sha": "62efafa9ce7c90278ae5c75b1d6bf28fc4e2e7be",
          "name": "policy / policy",
          "status": "in_progress"
        },
        {
          "check_run_id": 94426477457,
          "conclusion": null,
          "head_sha": "62efafa9ce7c90278ae5c75b1d6bf28fc4e2e7be",
          "name": "security / action-policy",
          "status": "in_progress"
        },
        {
          "check_run_id": 94426475728,
          "conclusion": null,
          "head_sha": "62efafa9ce7c90278ae5c75b1d6bf28fc4e2e7be",
          "name": "validate",
          "status": "in_progress"
        }
      ],
      "observed_human_steward_markers": [],
      "observed_non_author_reviews": [
        {
          "actor": "jimsteeg",
          "commit_sha": "c5a0a64cefed06964605d4ac4b08863bb6de4343",
          "review_id": 4925603504,
          "state": "DISMISSED",
          "submitted_at": "2026-08-13T09:43:50Z"
        }
      ],
      "operation": "PRVSR-PHASE1-IMPLEMENTATION-001",
      "required_status_contexts": [
        "Replay LOG-GCD-001 in Lean",
        "Replay PC-WP04 bounded certificate",
        "Replay pinned Union-Closed MATHCERT evidence",
        "policy / policy",
        "security / action-policy",
        "validate-json"
      ],
      "ruleset_source_available": true
    }
  },
  "nonclaims": [
    "PRVSR is advisory and derived; authoritative GitHub/governance records remain controlling.",
    "Report absence, staleness, generation failure, render failure, or archive failure is not a merge blocker.",
    "No cross-repository propagation authority is created.",
    "No claim is made that reviewer speed or factual accuracy improves.",
    "Machine collection does not infer missing human, mathematical, source-admission, or certification authority."
  ],
  "provenance": {
    "generator_version": "0.1.0-pilot",
    "observed_at": "2026-08-13T11:01:41Z",
    "schema_version": "1.0.0",
    "source_snapshot_sha256": "0f86d66b17965baf1e863455a0194ec8c3973f73b39bbdb3ca9610062579f1d6"
  },
  "report_id": "PRVSR-LIVE-PR503-62efafa9ce7c-20260813110141",
  "significance": {
    "manual_override": {
      "authority": null,
      "enabled": false,
      "reason": null
    },
    "profile_version": "1.0.0",
    "significant": true,
    "triggers": [
      "governance_or_control_plane",
      "administrative_automation"
    ]
  }
}
